304,ii,C,Crocodon,Crocodon.png,Their jaws were strong enough to snap a semi-truck in half. Their spikes could quintuple in length and they would spin with their prey impaled on them to rip them into pieces.,,
305,ii,W,Wotter,Wotter.png,"They travel in groups and take multiple things from towns and buildings. They cause mischief wherever they go, but their cute appearance covers that fact.",,
306,ii,S,Sailott,Sailott.png,"They watch over Wotter's heists and antics to make sure that all of them make it back. Using both of its eyes, it can't see that well, but when one of them is closed, they can see extremely well as if they are using binoculars.",,
307,ii,P,Pirott,Pirott.png,"They command Wotter and Sailott to steal and bring back any valuable items, which it keeps in a special place. It uses its iron claws, which can switch paws at any time, to intimidate those it is stealing from.",,
308,ii,W,Wataloo,Wataloo.png,"Its lower body isn't as developed as its upper body, so it has a diaper made of foam and bubbles to aid in its walking. When it is hurt, it absorbs water through its bubble diaper to heal itself.",,
309,ii,M,Manasea,Manasea.png,"It gives off a strange aura whenever it falls down. Despite its legs being fully developed, it still has trouble walking.",,
310,ii,W,Watullius,Watullius.png,"Fully grown, it is able to to walk perfectly on all fours and on two legs. It is able to scale waterfalls and create giant holes in the sea using its magic orbs in order to catch prey.",,
311,ii,K,Kalique,Kalique.png,"Kalique feign innocence to get on the good side of people, only to steal from them when left alone. They are said to be descendants of ancient gods, so they are often treated like royalty.",,
312,ii,J,Jakunn,Jakunn.png,"Jakunn usually serve <a href=""/wiki/Kalique"" title=""Kalique"">Kalique</a> and <a href=""/wiki/Dibolika"" title=""Dibolika"">Dibolika</a>, doing whatever they tell them to do. They have been known to steal valuables from museums, stores, and homes in order to try and earn favor with their evolved forms.",,
313,ii,D,Dibolika,Dibolika.png,"Ancient texts described them as reincarnations of cruel deities. When in battle, it uses extremely underhanded tactics, going as far as to try to attack the opposing trainer so that they can't give their Pokemon any instructions.",,
314,ii,C,Cerleu,Cerleu.png,"It hates getting attention, as it makes them feel inferior, which is difficult for them because of their fur's lack of pigment. Nobody knows why, but it is born with gray fur, which turns white as it continues to grow.",,
315,ii,L,Leucervid,Leucervid.png,"If anyone makes eye contact with it, it goes into a blind rage. Its fur color makes it feel worthless, causing it become enraged because of its own insecurity.",,
316,ii,H,Hopo,Hopo.png,These Pokemon came into existence when a rabbit died in a magician's hat during a magic act. It uses magical power in order to defend itself.,,
317,ii,C,Cakaseed,Cakaseed.png,These Pokémon came to life when young slaves possessed a scarecrow. It is said that they see their past lives through their blood red eye.,,
318,ii,R,Recrowile,Recrowile.png,"After a farmer died in his barn, it was thought that this Pokémon was his reincarnation. It wanders fields and gardens, reliving every moment of his life by looking through its bloody eye.",,
319,ii,A,Assasect,Assasect.png,"These Pokémon have the agility and grace of a silent assassin. It never makes a sound when battling, making it able to defeat opponents quickly.",,
320,ii,S,Symbia,Symbia.png,"They are commonly found in the mouths of <a href=""/wiki/Mollusym"" title=""Mollusym"">Mollusym</a>, eating bits of sand and algae that it swallows. Symbia and Mollusym have a symbiotic relationship. Mollusym provides Symbia with shelter and food, and Symbia protects Mollusym's valuable pearls.",,
321,ii,M,Mollusym,Mollusym.png,"Inside of each of their mouths is a very valuable pearl, which the Symbia inside helps protects from intruders. They work in a symbiotic relationship, the Symbia gets a home and the Mollusym has protection.",,
322,ii,M,Monori,Monori.png,"By achieving enlightenment, this Pokémon's attack power increases tenfold. Its fluffy tail is made of mind fog, which allows it to read people's minds.",,
323,ii,P,Psytori,Psytori.png,"They float on their tails, which are composed of multiple stressful mists that it gives off as it meditates. The pearls around its neck helps it stay calm.",,
324,ii,P,Pumkid,Pumkid.png,"They were born from the spirits of those killed on Halloween night. Each Halloween night, they roam cities looking for more victims in order to increase their species number.",,
325,ii,G,Gourdaver,Gourdaver.png,"It uses its three legs to stab trees and take their life force, making them die. Its creepy look and body gave it the nickname, The Grotesque Gourd.",,
326,ii,T,Tiklok,Tiklok.png,"According to folklore, whenever the hands on its face strike midnight, a life is taken. It hangs on walls, pretending to be a clock, and frighten others that walk past it by rattling its pendulums.",,
327,ii,P,Pontaur,Pontaur.png,"As soon as it is born, it is able to run as fast as a jet. Their legs lack hooves, making them slightly defenseless, but the muscles inside make up for it.",,
328,ii,T,Taurough,Taurough.png,"Their hooves are strong enough to penetrate an <a href=""/wiki/Macernio"" title=""Macernio"">Macernio</a>'s armor. They work in groups in order to protect <a href=""/wiki/Pontaur"" title=""Pontaur"">Pontaur</a>.",,
329,ii,P,Penneswel,Penneswel.png,"The females of this species of Pokemon are known to be more attractive because of their fur, making them targets for hunters. The males will always try to protect the females from harm.",,
330,ii,L,Lagomelt,Lagomelt.png,"The males of this species are very defensive and protective, but can be known to have a sweet, mischievous side. The females use their beauty in order to manipulate the males into doing what they want.",,
331,ii,H,Harupt,Harupt.png,The females' fluffy fur is very durable and comfortable in order to protect their young. The males are extremely violent and will attack anyone who approaches its territory.,,
332,ii,S,Scleros,Scleros.png,"It hides in the shadows and stalks wanderers at night, stealing their life force as it stares at them until they are unable to continue moving. It is said that if you stare at them for too long, you lose the ability to see clearly.",,
333,ii,D,Demeyes,Demeyes.png,"Demeyes stalks wanderers at night, showing its bright eyes in order to steal their vision. There was an old wives' tale that said that Demeyes will steal the eyes of those who are malicious.",,
334,ii,G,Googoust,Googoust.png,"Googoust is the result of a malevolent spirit possessing the body of an infant. Extremely skittish, the spirit inhabiting Googoust's body comes out of its mouth and fights for both of them due to Googoust's inability to stand up for itself.",,
335,ii,T,Tonex,Tonex.png,It gives off a melodious sound when happy. Its voice is said to be the most beautiful out of all Pokémon in the Qiloh Region.,,
336,ii,X,Xylotone,Xylotone.png,"Its ""tail"" is actually its intestines, which it uses to let out different tones for its melodious sounds. It eats kelp and plankton in order to keep its throat moist.",,
337,ii,T,Tikeye,Tikeye.png,They are highly recognized as guide Pokémon because it is able to show people the errors that they make in the future. They can sense hostility and will match it by blasting beams from the mouth on its body.,,
338,ii,D,Doseyedo,Doseyedo.png,"They are said to read auras and bend ones mind to their will. They use their eyes to view into the past, present, and future.",,
339,ii,P,Pseye,Pseye.png,It is said to be the wisest Rock-type Pokémon. The multiple eyes on its body are the source of it massive power.,,
340,ii,K,Kuselass,Kuselass.png,Kuselass are said to be the spirits of female students that left this world via accidents. They target females and immediately attack them when they are the most vulnerable.,,
341,ii,Y,Yureibb,Yureibb.png,"This Pokémon haunts sandy areas, floating in place and just staring at a victim, causing paranoia. It seems to have no emotions, as it shows no pain from attacks and it never seems to do anything but stare into space.",,
342,ii,C,Crustition,Crustition.png,It occupies old hermit shells and only comes out when disturbed. Trainers who have this Pokemon are said to have no emotions later on.,,
343,ii,C,Cubite,Cubite.png,"Their tails are encased in ice, allowing it to block attacks that hit it. They freeze particles in the air in order to create snow.",,
344,ii,R,Rayookie,Rayookie.png,"They can breathe out snowflakes, making a fun time for children who encounter it. Their tails can fire snowballs and icicles as it swallows moisture in the air.",,
345,ii,D,Dimacrisal,Dimacrisal.png,They were created when the moon's energy had an impact on an icicle. They keep their heads stuck in the roofs of icy caves in order to keep their bodies from melting.,,
346,ii,T,Tolum,Tolum.png,"Their bodies are covered in a sweet, powdery substance that attracts unwanted attention to it. It loves to dance and can always cheer someone up.",,
347,ii,S,Suitee,Suitee.png,"Its body produces large amounts of sugar, which is often collected and used for pastries. At night, they gather in large groups and perform special dances that are said to bring joy and energy to those who see them.",,
348,ii,M,Maflano,Maflano.png,"Its tail is small and stubby when it is first born, but it slowly grows as it ages. They swing their tails against cave walls in order to knock out stones to eat.",,
349,ii,M,Macernio,Macernio.png,Its body is comprised of an extremely strong metal that cannot be melted easily. Their tail is their most powerful weapon; one mighty swing from it could demolish a pickup truck.,,
350,ii,C,Cubera,Cubera.png,"These Pokémon are independent and never want to be given much attention. Their snake-like tails can actually attack and bite anyone that comes to close to it, giving them a non-lethal dose of venom that causes headaches.",,
351,ii,M,Meravage,Meravage.png,"Their claws are covered in a toxic film that allows them to poison any opponent. Their tails have a mind of their own and are very aggressive; they often bite Meravage's rears, making them angrier.",,
352,ii,C,Chimeroar,Chimeroar.png,"They pretend to be asleep to give people and Pokemon a false sense of security as they move past, but their tails act as a second head and will inject them will a venom that causes instant paralysis. Their sharp teeth can shatter bones with just one crunch.",,
353,ii,K,Kibbelgo,Kibbelgo.png,"They are extremely frightened of humans in the wild, but once captured, it bonds instantly. They never use their wings because they are scared of heights and as a result their wings are stiff.",,
354,ii,D,Drigano,Drigano.png,"When <a href=""/wiki/Kibbelgo"" title=""Kibbelgo"">Kibbelgo</a> evolves, it gains more confidence, but it also gains a cold personality. It doesn't care about the pain it causes or the condition its trainer or teammates are in; because of this, many trainers refuse to evolve Kibbelgo, causing a depletion in the species.",,
355,ii,I,Ionatt,Ionatt.png,"It is said to have a special relationship with the Pokémon VIRUBIC2. It assists scientists in labs, charging and powering their inventions.",,
356,ii,G,Galvanatt,Galvanatt.png,"They are very resilient and able to produce more than 50,000 gigawatts of electricity. It is often fired into outer space to help with extremely massive power outages.",,
357,ii,F,Flamur,Flamur.png,The flames they breathe are black and will destroy anything that it touches. Groups of them sometimes charge into small towns and burn everything around it.,,
358,ii,B,Bealzuburn,Bealzuburn.png,Their black flames can incinerate an entire forest in seconds. They always appear during times of strife to make everything worse.,,
359,ii,O,Oblimodor,Oblimodor.png,Its dark flames incinerate anything they touch. It is widely feared because of its evil tendencies.,,
360,ii,S,Spectrib,Spectrib.png,"Discovered in a cemetery, it is theorized that these Pokémon are the deformed skeletons of humans and Pokémon. Scientists have discovered that this Pokémon can survive even if it taken apart.",,
361,ii,R,Ribone,Ribone.png,"It is able to launch its body parts at enemies and immediately have it come back. The smoke around its body keeps it in check and without it, its body becomes nothing more than a pile of bones.",,
362,ii,B,Bomini,Bomini.png,"It protects itself with an unused bomb shell. Because it resembles a toy, it is often taken and tossed around by children.",,
363,ii,S,Sproket,Sproket.png,"They were discovered by scientists in a mechanical engineering factory. Their bodies are not well structured, but they are still able to fly perfectly by adjusting the weight of their underdeveloped arm and leg.",,
364,ii,L,Litekore,Litekore.png,"Their bodies, now fully developed, allow it to travel at the speed of light. Its crest holds special coordinates that tell it where to go.",,
365,ii,A,Aquite (female),Aquite-Female.png,xxx,,
366,ii,R,Reille,Reille.png,"They are known to cause mischief and trouble for fun. They hate being stopped by others, especially OCEOGO.",,
367,ii,D,Damsoak,Damsoak.png,They use their beauty and Fairy-type moves to keep PROTECRESS in check. They do a lot of water-related pranks in cities while staying under the radar.,,
368,ii,A,Aquite (male),Aquite-Male.png,xxx,,
369,ii,O,Oceogo,Oceogo.png,"They enhance their strength by sitting underneath waterfalls. They are highly protective of anything that is rightfully theirs, as well as female Pokemon.",,
370,ii,P,Protecress,Protecress.png,"He tries his hardest to protect others from DAMSOAK's mischief, but he always ends up getting transfixed on her beauty. He concentrates and plans his own strategies in battle.",,
371,ii,H,Hawte,Hawte.png,"Its warm, molted feathers are often made into beautiful clothing. They are able to fly, but only in short intervals. The thick feathers covering their body cushion their landing when they fall.",,
372,ii,V,Valiame,Valiame.png,"As it flies, its fiery feathers sometimes fall out, but are immediately replaced by new ones. By flapping its wings, it can cause a minor heat wave in a matter of seconds.",,
373,ii,S,Stwinkle,Stwinkle.png,They are able to blind enemies by letting the electricity inside their connected body bounce around and escape. It is often targeted by poachers and jewel thieves.,,
374,ii,S,Sparklug,Sparklug.png,The green gem in the center is the main control unit of all of the other diamonds. They are able to blind their enemies by reflecting light in their direction.,,
375,ii,Z,Zashaunt,Zashaunt.png,"Zashaunt are said to be the spirits of children who lived lavish lives; they are very friendly toward children. They are very mischievous, moving around the furniture and clothing in the homes in which they reside to frustrate the adults; despite their mischievous natures, they care about their homes and will watch out every night in order to ensure that no unwanted visitors intrude.",,
376,ii,G,Gurmrr,Gurmrr.png,"They attack without mercy, biting and clawing at an attacker until they stop moving. They were known to guard castles in olden times.",,
377,ii,C,Chomutila,Chomutila.png,"They are known to shred their prey into pieces. Their bodies are covered in a mixture of their own, as well as their victims', blood.",,
378,ii,C,Coolyn,Coolyn.png,"They freeze their fur, making it as sharp as needles, whenever they are touched by those they don't like. Their fur is usually a brownish-gray, but it turns white as it grows.",,
379,ii,F,Frosleet,Frosleet.png,"Their large paws act as snowshoes, making it so they don't sink or slip while walking across snowy areas. They are often used as guides to help people get across snowy areas.",,
380,ii,L,Lynorth,Lynorth.png,"Its sensitive paws are covered in thick hair, protecting them from the cold. Its natural enemy is <a href=""/wiki/Snokami"" title=""Snokami"">Snokami</a>.",,
381,ii,G,Gargone,Gargone.png,"Its arms are always extended in a zombie-like fashion. It always stares blankly from the tops of buildings, observing everything it sees.",,
382,ii,G,Gravoyle,Gravoyle.png,"It perches itself atop buildings and treetops, watching whoever goes by. It occasionally goes by and attacks who it sees without a particular reason.",,
383,ii,S,Spyno,Spyno.png,"They are extremely emotional and dislike when people argue. Their spikes can release a fluid that can heal wounds, making them sought by doctors and pharmacists.",,
384,ii,D,Dynospyke,Dynospyke.png,"The orb on its chest can detect anger and spite, which makes it very upset. Its spikes can be used to calm and make hostile enemies friendly.",,
385,ii,S,Spykosor,Spykosor.png,"Their discarded spikes are were once used to create medicines. Its diet consists mainly of leaves and branches; the more it eats, the stronger its Psychic abilities become.",,
386,ii,R,Raiote,Raiote.png,They raise their tails during thunderstorms to charge themselves. They are very excitable and playful Pokémon that need to keep moving in order to keep up their energy.,,
387,ii,A,Ampark,Ampark.png,"It is hypothesized that when they reach a certain level of enjoyment and excitement, their power reaches their full level. They are usually the cause of unusual thunderstorms.",,
388,ii,C,Coyatt,Coyatt.png,They unleash thunderbolts from their palms. They absorb electricity through their tail and use it to gain energy so it is able to move quickly.,,
389,ii,V,Virubic,Virubic.png,They reside in a cyber world where no one is able to find it without the help of computer specialists. It was said to have been created to solve an unknown software problem; it seems to have failed...,,
390,ii,V,Virubic2,Virubic2.png,"An upgraded version of Virubic thanks to an Ionatt's influence, it combats them in order to fix computer software. It has been very effective, though it is known to have a few errors.",,
391,ii,S,Starvine,Starvine.png,"Their vine whip techniques are unmatched, as their vine tails have minds of their own. Sometimes, the tail will whip around and trip up the Pokemon itself.",,
392,ii,M,Midmow,Midmow.png,"They train themselves to command and use their vine tails professionally in order to strike. Its tails always eat the grass that surrounds it as it hunts for prey, making finding food difficult.",,
393,ii,E,Enbush,Enbush.png,"They sit in dense grassy areas and wait for unsuspecting prey to come so it can attack with its tails. It blends in with its surroundings so well that it is called ""The Walking Grassland"".",,
394,ii,Z,Zinchar,Zinchar.png,"When they are first born, their bodies are a pale yellow. As they grow, their body temperatures continue to rise, giving them their red coloration. Their bodies are mostly comprised of steel.",,
395,ii,B,Blazinc,Blazinc.png,"Blazinc are often used in trash disposal, incinerating large quantities of trash with their flames. If their bodies cool down, they become extremely sluggish and sick.",,
396,ii,T,Titanius,Titanius.png,"Their body temperatures can reach 800,000 °F when they are furious. The metal outside of its body cannot be melted.",,
397,ii,A,Awteau,Awteau.png,"Possessed by the spirits of engineers, these Pokemon build strange items and place them in palaces and museums. They cover their V-shaped eye hole and retract their arms and legs in order to make it appear as an artifact.",,
398,ii,D,Damedge,Damedge.png,"Sometimes, the spirit inside escapes through its eye hole to personally attack those who have angered it to a certain extent. It can change its claws and use them as tools to help fix broken machinery and make them even better.",,
399,ii,S,Stablunt,Stablunt.png,"Over time, its armor's legs fell off, allowing the ghostly spirit inside to partially escape. It shoots metal shrapnel from its body to pierce its enemies.",,
400,ii,D,Daiuno,Daiuno.png,"It is difficult to find, capture, train, and please this Pokemon. It is said to have taken a successful trainer 3 years to completely get their DAIUNO to appreciate and like them.",,
401,ii,D,Daudegoch,Daudegoch.png,"No matter what you do for them, these Pokemon are always unsatisfied. Sometimes, they disappear and expect their trainers to come after them and tend to their wants.",,
402,ii,T,Triragoch,Triragoch.png,"These Pokemon are very greedy when it comes to their power and will only use their full strength when they want. If their trainer does not pay attention to them or does what they want, they will not hesitate to attack them.",,
403,ii,K,Kakonas,Kakonas.png,"Born from an orange crystal that fell from space, it, along with <a href=""/wiki/Genzanas"" title=""Genzanas"">Genzanas</a> and <a href=""/wiki/Shoranas"" title=""Shoranas"">Shoranas</a>, are able to time travel. It keeps itself hidden as it spectates humans and Pokemon, viewing what happened in their pasts.",,
404,ii,G,Genzanas,Genzanas.png,It is able to easily manipulate things in the present day when it feels that something negative is about to happen. Tugging on the cords on its chest heightens its Psychic power.,,
405,ii,S,Shoranas,Shoranas.png,"It is assumed that it was the one born as the leader over its siblings because of its old appearance. Able to see the futures of other people and Pokémon, it tries its best to ensure that negative things do not transpire due to the antics of its siblings.",,
406,ii,A,Aedaragia,Aedaragia.png,She is known to have created the land of the Qiloh Region. She works alongside with Patanoros to keep Qiloh a prospering region.,,
407,ii,P,Patanoros,Patanoros.png,"He is able to keep away all storm clouds, but also allows him when he is needed for vegetation. He has helped protecting Qiloh from hurricanes and tornadoes by devouring them.",,
408,ii,C,Chupaca (gracious)/Chupaca (ravenous),Chupaca-Gracious.png/Chupaca-Ravenous.png,"One legend states that this savage legendary devoured livestock and left the bones arranged at the village's entrance, striking fear into the villagers.  This Pokémon is known for its menacing attitude towards The Time Keepers, as they constantly end up hindering its feasting session every time they travel through time.",,
409,ii,R,Rokinka,Rokinka.png,"The rings on its tail glow brightly as it brings newly found ideas and power to those who wish to have them. It has a very kind, but mischievous nature, taking and bringing cultures and ideas to different places in the world.",,
